{
  "schema": "echelon.release-set/v1",
  "channel": "echelon-current",
  "profile": {
    "id": "echelon-current",
    "version": "1.28.0",
    "path": "profiles/echelon-current.profile.json",
    "sha256": "4261346fa179c59302627da7f6af569609efb6b80be0dd3d284874b535f773f0"
  }, 
  "catalogSnapshot": {
    "path": "snapshots/echelon-current.catalog.json",
    "sha256": "d7f34d13855864b5c18575d5864c6990ef6b0e77d8fb64f5bc665adc16c6cde0"
  },
  "channelIndex": {
    "path": "channels/echelon-current/channel.json",
    "sha256": "a02a8c779ba5f69bc67466416755d1cecefc6d2d4dd8e1aff680f4c0842520f9"
  },
  "platforms": [
    {
      "platform": "linux-x64",
      "path": "channels/echelon-current/linux-x64.json",
      "sha256": "5aee6c3c355dbb1b556d7a1dba9db80ece9c88862f31239c3558c441bb7abc67"
    },
    {
      "platform": "linux-arm64",
      "path": "channels/echelon-current/linux-arm64.json",
      "sha256": "c6e96a3b22e0a06e806f69ecdfbacf21ac772c3809fd2cabfd4c85231172e7b8"
    },
    {
      "platform": "osx-x64",
      "path": "channels/echelon-current/osx-x64.json",
      "sha256": "e46a5ed3cda713bb52345d8618fd05c1388a1fad1bbd15be9a3e8c617667073c"
    },
    {
      "platform": "osx-arm64",
      "path": "channels/echelon-current/osx-arm64.json",
      "sha256": "c32dae405b765919b52b2bdfafe4489e2639e5a3d7ec0d9534d3afa2bc10dc77"
    },
    {
      "platform": "win-x64",
      "path": "channels/echelon-current/win-x64.json",
      "sha256": "c1535207a2879a27f11a45fc5cbc6c7d1ec438df533f9171fa7d67ac1285aa1c"
    }
  ],
  "components": [
    {
      "systemId": "praxis",
      "version": "3.21.0",
      "releaseManifestSha256": "6fed7eea26039704ec28e58b655cd1c6b7d0228cabe668afb4c49cd222af58c1",
      "platforms": [
        "linux-x64",
        "linux-arm64",
        "osx-x64",
        "osx-arm64",
        "win-x64"
      ]
    },
    {
      "systemId": "ordo",
      "version": "1.17.0",
      "releaseManifestSha256": "d9ee8be3b8723582389bcade5a969827f92a89266aab801c7e6b6e3bc224e0e8",
      "platforms": [
        "linux-x64",
        "linux-arm64",
        "osx-x64",
        "osx-arm64",
        "win-x64"
      ]
    },
    {
      "systemId": "percepta",
      "version": "0.1.0",
      "releaseManifestSha256": "07b6291c63ff25e6b669edb8c845e48ba76831b6a6133efa4ad3a390439b1b2b",
      "platforms": [
        "linux-x64",
        "linux-arm64",
        "osx-x64",
        "osx-arm64",
        "win-x64"
      ]
    },
    {
      "systemId": "percepta-semantic",
      "version": "0.2.1",
      "releaseManifestSha256": "156ef405778000991724e95c7cf80e3761d189397e1c069207055cce100b3e37",
      "platforms": [
        "linux-x64",
        "linux-arm64",
        "osx-x64",
        "osx-arm64",
        "win-x64"
      ]
    },
    {
      "systemId": "dokimos",
      "version": "0.7.0",
      "releaseManifestSha256": "c3faefc6ae60a718bbc15aa0e93eb0d8dde3ef18e344f0c15dbae8eb4e0e0ddf",
      "platforms": [
        "linux-x64",
        "linux-arm64",
        "osx-x64",
        "osx-arm64",
        "win-x64"
      ]
    },
    {
      "systemId": "visual-engineering",
      "version": "1.0.1",
      "releaseManifestSha256": "23ab4fdb38d3fc7827519cc3c29df88c950211db1d53d114c53f36a662a0dbda",
      "platforms": [
        "linux-x64",
        "linux-arm64",
        "osx-x64",
        "osx-arm64",
        "win-x64"
      ]
    },
    {
      "systemId": "communication-engineering",
      "version": "1.0.0",
      "releaseManifestSha256": "d4b79053301635b6335caf81c2ca28b0721cca4a78967501be820a8eb7118296",
      "platforms": [
        "linux-x64",
        "linux-arm64",
        "osx-x64",
        "osx-arm64",
        "win-x64"
      ]
    },
    {
      "systemId": "tutela",
      "version": "0.1.0",
      "releaseManifestSha256": "5db1e8a1f039ae88b2b9426c7cbeec1783b40e29d58b0dfd40dfa90104a3c4ba",
      "platforms": [
        "linux-x64",
        "linux-arm64",
        "osx-x64",
        "osx-arm64",
        "win-x64"
      ]
    },
    {
      "systemId": "aegis",
      "version": "1.0.0",
      "releaseManifestSha256": "4530cfa3396c1e57d3e1a6500c661cd2d520236e852d1d9e88aa44c385d0bd6b",
      "platforms": [
        "linux-x64",
        "linux-arm64",
        "osx-x64",
        "osx-arm64",
        "win-x64"
      ]
    },
    {
      "systemId": "limen",
      "version": "0.9.0",
      "releaseManifestSha256": "5ffc580705cb612f9a5c99ee7ee0f81c7f18904947336a6e14a9be19393a74db",
      "platforms": [
        "linux-x64",
        "linux-arm64",
        "osx-x64",
        "osx-arm64",
        "win-x64"
      ]
    },
    {
      "systemId": "forma",
      "version": "0.9.0",
      "releaseManifestSha256": "674c10a5a317c5e4dbf2f52a495ae3ec4a995907c24d86e02c0bdc3625f70da9",
      "platforms": [
        "linux-x64",
        "linux-arm64",
        "osx-x64",
        "osx-arm64",
        "win-x64"
      ]
    },
    {
      "systemId": "folio",
      "version": "0.4.1",
      "releaseManifestSha256": "d453d980ce7f81e3c5bd227e34bd8d287417ea79ca09aa97ae9fdc56a28c6880",
      "platforms": [
        "linux-x64",
        "linux-arm64",
        "osx-x64",
        "osx-arm64",
        "win-x64"
      ]
    },
    {
      "systemId": "strata",
      "version": "0.1.1",
      "releaseManifestSha256": "262bf735e8af934a5d104cad910e34d55e8ffcf310696f8604560bc73eb8ab04",
      "platforms": [
        "linux-x64",
        "osx-x64",
        "osx-arm64",
        "win-x64"
      ]
    },
    {
      "systemId": "arca",
      "version": "0.5.0",
      "releaseManifestSha256": "1cab5320290e6084f873e942465fe2289c8bc952b8ec7ce3a445ad24b8ac2e84",
      "platforms": [
        "linux-x64",
        "linux-arm64",
        "osx-x64",
        "osx-arm64",
        "win-x64"
      ]
    },
    {
      "systemId": "fides",
      "version": "0.2.0",
      "releaseManifestSha256": "0ef2204d8ec298e6d930ce11d66629794486a5e31367959d7f9dbd39468b6a2a",
      "platforms": [
        "linux-x64",
        "linux-arm64",
        "osx-x64",
        "osx-arm64",
        "win-x64"
      ]
    },
    {
      "systemId": "summa-contracts",
      "version": "0.1.0",
      "releaseManifestSha256": "b952e4c667bc83aae23092397e8de3bcd75ecd2a6d59ef7d1047f2f5d094bcfe",
      "platforms": [
        "linux-x64",
        "linux-arm64",
        "osx-x64",
        "osx-arm64",
        "win-x64"
      ]
    },
    {
      "systemId": "limen-fsharp",
      "version": "0.9.0",
      "releaseManifestSha256": "d8aec120fdaff6bb2a9dcd6e4d79b8a92d69f8cc0227de1c6b7166c6c3b8ce3a",
      "platforms": [
        "linux-x64",
        "linux-arm64",
        "osx-x64",
        "osx-arm64",
        "win-x64"
      ]
    }
  ],
  "capabilities": [
    {
      "id": "verified-completion-attested",
      "platform": "linux-x64",
      "state": "enabled"
    },
    {
      "id": "verified-completion-attested",
      "platform": "linux-arm64",
      "state": "enabled"
    },
    {
      "id": "verified-completion-attested",
      "platform": "osx-x64",
      "state": "enabled"
    },
    {
      "id": "verified-completion-attested",
      "platform": "osx-arm64",
      "state": "enabled"
    },
    {
      "id": "verified-completion-attested",
      "platform": "win-x64",
      "state": "enabled"
    }
  ],
  "status": "approved",
  "assessments": [
    {
      "systemId": "praxis",
      "version": "3.14.0",
      "assessment": "superseded",
      "reason": "Superseded by the selected Praxis 3.21.0, which carries its changes; qualified by released Conditor but in no catalog snapshot"
    },
    {
      "systemId": "praxis",
      "version": "3.15.0",
      "assessment": "superseded",
      "reason": "Superseded by the selected Praxis 3.21.0, which carries its changes; never qualified by a released Conditor and in no catalog snapshot"
    },
    {
      "systemId": "praxis",
      "version": "3.17.0",
      "assessment": "superseded",
      "reason": "Superseded by the selected Praxis 3.21.0, which carries its changes; never qualified by a released Conditor and in no catalog snapshot"
    },
    {
      "systemId": "praxis",
      "version": "3.18.0",
      "assessment": "superseded",
      "reason": "Superseded by the selected Praxis 3.21.0, which carries its changes; never qualified by a released Conditor and in no catalog snapshot"
    },
    {
      "systemId": "praxis",
      "version": "3.19.0",
      "assessment": "superseded",
      "reason": "Superseded by the selected Praxis 3.21.0, which carries its changes; never qualified by a released Conditor and in no catalog snapshot"
    },
    {
      "systemId": "praxis",
      "version": "3.20.0",
      "assessment": "superseded",
      "reason": "Replaced by Praxis 3.21.0 (v3.21.0, fa474c42): 3.20.0 plus the requirements-preservation gate (praxis requirements preservation verify, praxis#292), with provides and release.json compatibility (remote protocol 1.4, state schemas) unchanged. Indy-init needs the gate (PRE-REQ-03, RDP-004)"
    },
    {
      "systemId": "dokimos",
      "version": "0.6.0",
      "assessment": "superseded",
      "reason": "Superseded by Dokimos 0.7.0: the verified-completion-attested pairing (Praxis >=3.17.0 requires Dokimos >=0.7.0) refuses Dokimos 0.6.0 beside the selected Praxis 3.21.0"
    },
    {
      "systemId": "folio",
      "version": "0.4.0",
      "assessment": "superseded",
      "reason": "Replaced by Folio 0.4.1 (v0.4.1, a94cea73), the newest stable release (Indy-init F-015, OD-INDY-8): its package adds print styles and the Forma icon-print tools and declares no runtime dependencies. The selection stands only once a released Conditor qualifies 0.4.1 (REG-RU-007)"
    },
    {
      "systemId": "forma",
      "version": "0.9.1",
      "assessment": "pending",
      "reason": "Not tagged on 2026-10-26 (newest tag v0.9.0, git ls-remote); not registered"
    },
    {
      "systemId": "limen",
      "version": "0.9.1",
      "assessment": "pending",